assessmentId,internalTaxonId,scientificName,redlistCategory,redlistCriteria,yearPublished,assessmentDate,criteriaVersion,language,rationale,habitat,threats,population,populationTrend,range,useTrade,systems,conservationActions,realm,yearLastSeen,possiblyExtinct,possiblyExtinctInTheWild,scopes
10838671,43993,Vanvoorstia bennettiana,Extinct,,2003,2003-04-30 00:00:00 UTC,3.1,English,"The red alga <em>Vanvoorstia bennettiana</em> has only ever been collected from two sites (in the world).  The initial discovery, the type locality, was from the seabed at the eastern end of Spectacle Island in Parramatta River sometime between the 1st and the 16th May in 1855.  This site is now operated by the Royal Australian Navy as an explosives storage (barge), administrative offices and a mooring site for destroyers and other large Naval vessels.  The shoreline has been altered and strengthened and the seabed is regularly dredged to allow ample draught for large ships.  This site was first surveyed by myself and colleague Mr Peter Richards in December 1988.  Since then, seven dives during all seasons up until  23 April 2001, have been undertaken at that site.  No specimens have been discovered, and the only alga found there was a species of the genus <em>Sargassum</em>, that appears to tolerate low light, high nutrient, regularly disturbed conditions.
<br/>
<br/>The only other site known to have harbored this species was on the seabed between Point Piper and Shark Island in Port Jackson (Sydney Harbour).  This was collected by Dr Ramsay of the Australian Museum in October 1886.  This site was also surveyed by myself and colleague Mr Peter Richards firstly in December 1988 then numerous times (approx 10) since.  The seabed in this area now has no solid rocky substrata to which any seaweed could attach, the sediment is approximately 1 m thick (a divers arm disappears to the shoulder) and is easily stirred up by divers and passing ferry traffic.  The surrounding rocky foreshore of both Point Piper and Shark Island have only small amounts of the kelp <em>Ecklonia radiata</em> and the green alga <em>Caulerpa filiformis</em> growing on them. Both are known to tolerate heavily disturbed conditions.  No specimens of <em>Vanvoorstia bennettiana</em> have been discovered.
<br/>
<br/>Within Parramatta River and Port Jackson proper, I have logged some 50 dives from 12 different sites, all of which have reasonable coverage of a few marine algal species typical of the NSW coastline.  Based on knowledge of two other species in the genus <em>Vanvoorstia</em>, in addition to known growth strategies and environmental preferences of other genera and species of the red algal family Delesseriaceae, to which <em>Vanvoorstia bennettiana</em> belongs, such areas should harbor this species.  In 1913, the then Curator of Algae at the Royal Botanic Gardens Sydney, Arthur Lucas, published a paper in the Proceedings of the Linnaean Society of NSW in which he states ""I have never obtained it [<em>Vanvoorstia bennettiana</em>] either cast up or by dredging.""  He was an active collector of algae along the NSW coast up until his death in 1936.  The next Curator of Algae was Ms Valerie May who was also an active collector until her retirement in 1988, when I took over the position.  She was also unable to rediscover this species.
<br/>
<br/>Since 1980, I have logged in excess of 540 dives along the NSW coast as part of  a state government research priority to document the entire marine algal flora of the coast.  Our collections have come from Cape Howe in the very south of the state, to Cook Island on the Queensland/NSW border, with approximately 100 sites scattered in between.  The red algal species <em>Vanvoorstia bennettiana</em> has not been discovered during any of these dives.
<br/>
<br/>Several colleagues of mine from the universities of Southern Cross, New England, NSW, Sydney, and Wollongong, plus the Solitary Island Underwater Research Group (SURG), and the operators of every commercial dive shop I have worked through in NSW, have all been briefed on the identification of this and several other rare species of marine algae. None has reported a sighting during the 12 years I have been based at the Royal Botanic Gardens Sydney. The genus is known to have an isomorphic alternation of generations.  This means that the haploid male and female macrophytic gametophytes are morphologically identical to the diploid macrophytic tetrasporophytes which they ultimately produce.  There is no crustose or resting stage in the life cycle of the species, which may have allowed it to lie dormant for many years until environmental conditions were favourable.  In short, both life stages are susceptible to the same environmental parameters.
<br/>
<br/>The Extinct category is used 'when there is no reasonable doubt that the last individual has died.' With negative data there can always be some doubt. And new species continue to be found in Australian marine waters, even in Sydney Harbour (J.R. Paxton in litt.). The presence of 15 individuals in one collection indicates that  the species was relatively common in at least one portion of Sydney Harbour at that time. Given the isomorphic alternation of generations, it seems most unlikely that the species would remain in existence and remain undetected for more than 100 years. Therefore as no specimens have been seen or collected in the intervening 116 years, despite numerous collections made by algologists in that period, the species can be considered truly Extinct.","Unknown at time of collection in 1855 and 1886.  The two sites, and much of Sydney Harbour, presently has soft sediment seabed with scattered rocky reef and rocky intertidal shores.  Scattered shells and solid waste products (cans, bottles etc.) also lie on the seabed.","Sydney Harbour is in the middle of the city of Sydney, the largest metropolis in Australia with more than 4 million people. In the 200+ years since settlement, the harbour has been seriously degraded by the population explosion. Use of the harbour as recreational facility, port, source of food, and sewer has seriously impacted on the native flora and fauna. Even by 1880, the harbour was found to be overfished by a Royal Commission. The Major Threats that may have caused the extinction of this alga include large and small scale fisheries particularly trawling, infrastructure development including industry, human settlement, tourism/recreation, water transport [including dredging for ship passage], fisheries- related bycatch by netting, and water pollution from agriculture, domestic, commercial/ industrial, oil, sedimentation, and sewage. The water quality of the harbour has improved since the 1972 passage of the New South Wales Clean Waters Act and the more recent removal of sewage outfalls some kilometers offshore. More fish species have moved to the upper estuarine portions of the Parramatta River and whales have returned to the outer harbour. However, for sessile species of limited distribution like Bennetts seaweed, swimming out of the harbour was not an option and the damage was done, permanently. As we do not even know in which decade the extinction occurred, we will never know which of the major threats was causative; a combination of a number of those listed is likely. [Threats information provided by J.R. Paxton in litt.].",,,"First collected/discovered (1855) by crude dredging as a single individual plant from the east end of Spectacle Island, in the Parramatta River, Port Jackson, Sydney Harbour, New South Wales, Australia.  Second and last collection (1886) by dredging of approximately 15 individual plants from between Shark Island and Point Piper, Port Jackson, Sydney Harbour, New South Wales, Australia (8 kilometres east of Spectacle Island). Presently unknown.",,Marine,"Listed as a  ""Species Presumed Extinct""  in section 4 of Schedule 4 of the Fisheries Management Act 1994, in the state of New South Wales, Australia. Listed as ""Extinct"" under the Environment Protection and Biodiversity Conservation Act 1999, by the Commonwealth of Australia.",Australasian,1886,false,false,Global
12546193,6179,Cyprinus yilongensis,Extinct,,2011,2011-01-21 00:00:00 UTC,3.1,English,"Considered to have gone extinct as Yilong Lake dried up as a result of water&#160;abstraction&#160;for agriculture in the  1981.&#160;The&#160;species&#160;was surveyed for in 1983 and 1984, but was not found,  and recent surveys by the Kunming Institute of Technology have also not  found the species (W.&#160; Zhou pers. comm, 2011). No live specimens exist in captivity.",Previously recorded from a lake.,"Overfishing depleted populations of the species.<span class=""shorttext""> The water level of the lake declined since the 1950s. In 1981 the lake completely dried up (for about 20 days) as a result of water&#160;abstraction&#160;for agriculture. The lake is also polluted by increased organic pollution caused by sedimentation from the surrounding catchment.  Urbanisation and pollution from agriculture are also threats.","The species is thought to be extinct. The lake was surveyed in 1983-84 (W. Zhou pers. comm. 2011), and the species was not recorded. Recent surveys by the Kunming Institute of Technology have also not   found the species (W.&#160; Zhou pers. comm, 2011). No live specimens exist  in captivity.",,"The species is only known from Yilong Lake, Yunnan, southern China. The species was first described in 1977, from specimens collected in 1963-4.",The species was utilised in fisheries.,Freshwater (=Inland waters),No conservation actions are in place.,Indomalayan,1970s,false,false,Global
15361621,5438,Cottus echinatus,Extinct,,2013,2011-11-09 00:00:00 UTC,3.1,English,It is listed as Extinct because the species has not been observed since the 1920s despite adequate surveys to find it.,Its habitat included rocky nearshore areas of Utah Lake (Page and Burr 2011).,"Decreased water quality associated with agriculture, introduced fishes, and drought-associated low lake levels in 1930s may have led to extinction (Lee <em>et al.</em> 1980, Miller <em>et al.</em> 1989).",None remaining.,,"This species is extinct; historically, it was found only in Utah Lake, Utah (Page and Burr 2011).",This species was not utilized.,Freshwater (=Inland waters),"This species is extinct. No protection or major management, monitoring, or research actions are needed..",Nearctic,,false,false,Global
16935685,54837,Nectophrynoides asperginis,Extinct in the Wild,,2015,2014-07-25 00:00:00 UTC,3.1,English,"This species was listed as Extinct in the Wild (EW) in 2009 because no self-sustaining population existed in the wild at that time. The 2014 assessment is observing the five year rule set out in section 2.2.1 of the <a href=""http://cmsdocs.s3.amazonaws.com/RedListGuidelines.pdf""><em>Guidelines for Using the IUCN Red List Categories and Criteria</em></a>, which requires a species to remain in its original category for a time period of five years from the time it no longer meets the criteria for that category (IUCN Standards and Petitions Subcommittee 2014). As reintroductions began in 2013, the species will require reassessment in 2018. This five-year time period will allow for monitoring of the species' recovery and the viability of its re-introduced population.","This species lived only in soaked herbaceous vegetation in the spray zone of the Kihansi Falls. An artificial gravity-fed sprinkler system is currently in place to mimic the original conditions of the spray zone. The toad breeds by internal fertilization, with females retaining the larvae internally in the oviduct until little toadlets are born. Clutch size varies from 5–13 offspring (Channing <span style=""font-style: italic;"">et al. </span>2006).","The serious decline and extinction of this species appears tp be related to the Lower Kihansi Hydropower Project, which involved the construction of a dam upstream on the Kihansi River in 2000. The dam cut off 90% of the original water flow to the gorge, thereby hugely reducing the volume of spray, particularly in the dry season, as well as altering the vegetational composition. <br/><br/>An artificial gravity-fed sprinkler system was set up to mimic the natural spray of the Kihansi ecosystem with the remaining water flow. Unfortunately, the sprinkler system was not ready by the time the water was cut off in 2000, and by the time the sprinklers came on nine months later the ecosystem had already dried up (see Krajick 2006). Later, during the dry season in 2003, the artificial sprinkler system failed for a while. Around this time, the fungal disease chytridiomycosis was confirmed in dead animals of this species, and this disease is probably responsible for the final population crash. It is possible that the drought caused by the failure of the sprinkler system resulted in stress to the animals that rendered them susceptible to the disease. There are also reports that the 2003 crash coincided with a brief opening of the dam's floodgates to flush sediments; tests showed that these contained pesticides used in maize farming operations upstream, in concentrations sufficient to kill the toads (Krajick 2006). The impact of predation by safari ants (<span style=""font-style: italic;"">Dorylus</span> sp.) and crabs (<span style=""font-style: italic;"">Potomonautes</span> sp.) is unknown (Channing <span style=""font-style: italic;"">et al.</span> 2006).","Formerly it was abundant in a tiny area, with a population of around 17,000 individuals. Reports indicate that the species fluctuated naturally in its population size. The population appeared to be at a high in May 1999, dropping to lower numbers in the course of 2001 and 2002 [total population estimates oscillated at around 11,000 individuals up until March 2002; see Channing <span style=""font-style: italic;"">et al.</span> 2006], and at a high again in June 2003 [a total population estimate of 20,989 individuals; Channing <span style=""font-style: italic;"">et al.</span> 2006]. However, subsequently the population went into steep decline, and by mid-January 2004, only three individuals could be seen and just two males were heard calling. There were a few records of calling animals during the rest of 2004, and an unconfirmed report from May 2005 (CBSG 2007), but there were no records of any individuals in subsequent years, despite surveys, leading to the species being listed as Extinct in the Wild in May 2009.<br/><br/>In an effort to re-introduce the species into the wild, Toledo and Bronx Zoos have been conducting an <em>ex situ</em> breeding programme. In June 2012 1,000 toads were involved in release experiments (where some were retained in a captive facility at Kihansi and a few were sent to the gorge). In October 2012 2,000 toads were re-introduced back to the gorge. In October 2013 2,000 toads were involved in several activities (where some were kept at Kihansi captive breeding facility, some were used for release experiments and some were re-introduced back to the gorge). There is a plan to re-introduce another 2,000 toads to the wild probably in October 2014 (W. Ngalason&#160; pers. comm. July 2014).",,"This species was a micro-endemic of the Kihansi Falls, in the Kihansi Gorge, in the Udzungwa Mountains, eastern Tanzania, at 600-940 m asl. Its global range covered an area of less than two hectares around the Kihansi Falls, and searches for it around other waterfalls on the escarpment of the Udzungwa Mountains have not located any additional populations  (Channing <span style=""font-style: italic;"">et al. </span>2006).","<p>In 2000, at the invitation of the Tanzanian government, the Bronx Zoo collected 499 individuals to establish an <em>ex-situ</em> breeding programme in view of creating an assurance population.<br/></p>",Terrestrial|Freshwater (=Inland waters),"This toad is not known from any protected areas. Sufficient minimum bypass flow from the dam is required to maintain the spray habitat and an artificial sprinkler system is in place to provide these conditions - this is especially important in the dry season. Captive breeding is ongoing in Toledo and New York Bronx Zoos, and a captive population was established at the University of Dar es Salaam in 2010. Soft-release experiments, as well as full re-introduction, are ongoing and the reintroduced population is under regular monitoring. It is listed on CITES Appendix I.",Afrotropical,2004,false,false,Global
18230889,8128,Etheostoma sellare,Extinct,,2013,2012-03-01 00:00:00 UTC,3.1,English,"It is listed as Extinct because the species has not been found since the 1980s, despite numerous efforts.","This species habitat includes fast rocky riffles of creeks (Page and Burr 2011). As of the 1980s, this darter inhabited the first major riffle above tidewater in Deer Creek; it also used (particularly young and juveniles) adjacent pools. The riffle has bottom ranging from rubble to gravel and has an abundance of rooted aquatic plants (Kuehne and Barbour 1983, Page 1983). Spawning occurs probably in gravel riffles.",The damming of the Susquehanna River reduced range. The last known occupied locality is in an area of degraded water quality impacted by agricultural runoff.,"This species probably is extinct. It was most recently confirmed from the last known location (Deer Creek) in 1986; one possibly was found there in 1988 (Lynn Davidson, pers. comm., 1997; see also USFWS, Federal Register, 15 February 1996). It would not be unexpected for the species to ""reappear.""<br/><br/>Probably no individuals remain. Historically the species was represented by small local population sizes of less than 100 individuals, less than 30 in two of the three sites (R. Raesly, pers. comm., 1995). Surveys in the early 1980s found only 1-10 individuals at any locality (Matthews and Moseley 1990).<br/><br/> USFWS (1990) categorized the status as ""declining.""",,"This species was known only from tributaries of the lower Susquehanna River, Harford County, Maryland (Page and Burr 2011). Most recently, this species was restricted to a single riffle in Deer Creek (the only known extant population in the 1980s); occasional strays have occurred in Gasheys Run downstream (where breeding habitat apparently is lacking). There are no recent records from the type locality (Swan Creek, near Havre de Grace, Maryland).",No information available.,Freshwater (=Inland waters),"This species is extinct, so it does not require protection or management, monitoring, or research action.",Nearctic,,false,false,Global
18233501,8891,Gambusia georgei,Extinct,,2013,2012-02-03 00:00:00 UTC,3.1,English,This species is listed as Extinct because no genetically pure individuals have been found since 1983.,"Historical habitat included a large vegetated spring and its effluent (Page and Burr 2011); shallow, quiet, mud-bottomed, shoreline areas without dense vegetation in the thermally constant main channel. Formerly this species was common under the shade of bridges. Primary habitat requirements appear to be clean, clear water of a relatively stable temperature (Matthews and Moseley 1990).","Decline was due to reduced spring flows and pollution, including herbicide spraying along the river; introduced fishes; spread of an ornamental plant (Elephant Ears, <em>Colocasia esculenta</em>); and, as it became rare, hybridization with <em>Gambusia affinis</em> (Miller <em>et al</em>. 1989).","No occurrences are extant.<br/><br/>Population in 1969 was estimated at less than 1,000 individuals; genetically pure individuals have not been collected since 1983 (Johnson and Hubbs 1989); presumed extinct (Miller <em>et al.</em> 1989, USFWS 1990).",,"Its historical range included the San Marcos Spring and upper few kilometres of the San Marcos River, Texas (Hubbs and Peden 1969, Page and Burr 2011).",,Freshwater (=Inland waters),"This species is extinct and does not require protection or management, monitoring, or research action.",Nearctic,1983,false,false,Global
19032197,17874,Pogonichthys ciscoides,Extinct,,2013,2012-08-04 00:00:00 UTC,3.1,English,"This species is listed as Extinct because it has not been documented since 1970, despite adequate surveys.",Adults were pelagic in the lake; littoral when young. Spawning occurred in gravel riffles in streams tributary to Clear Lake.,"This species' population declined precipitously in the 1940s, probably due to reduced water flow caused by irrigation methods, and increase in bluegill population (Moyle 1976); and possibly also due to applications of pesticides (Miller <em>et al</em>. 1989).","No occurrences, subpopulations, or locations for this species remain today.",,"This species' range included Clear Lake and its tributary streams, Lake County, California. Evidently it is now Extinct. It was last collected in 1970.",This species was not utilized.,Freshwater (=Inland waters),This species is extinct.,Nearctic,1970,false,false,Global
19033113,39291,Moxostoma lacerum,Extinct,,2013,2012-08-04 00:00:00 UTC,3.1,English,"This species is listed as Extinct because it has not been detected for more than 100 years, despite adequate surveys.","This species apparently preferred medium to large, warm streams of moderate gradient and with relatively low turbidity and silt levels. It probably occurred in slower runs and pools. Deep pools between shoal areas with clear water over a bedrock or rocky bottom in moderate to large streams (Miller <em>et al</em>. 1989).","Formerly, the species was common but it is now extinct, probably due to increased turbidity and siltation of habitat resulting from agricultural practices (Miller <em>et al</em>. 1989).",No extant populations are known to exist.,,"This species is now Extinct. It was collected between 1859 and 1893; known from five drainages of lower and central Ohio River basin, upper White River drainage of the Ozarks, and Maumee River drainage of Lake Erie basin.",This species was not utilized.,Freshwater (=Inland waters),"This species is extinct and does not require protection or management, monitoring, or research action.",Nearctic,,false,false,Global
21426347,10332,Hydropsyche tobiasi,Extinct,,2014,2013-10-03 00:00:00 UTC,3.1,English,"This species occurred in an intensively studied part of the world and has not been recorded since 1938 despite searches for it in all recorded localities. Voucher specimens were only found in collections originating from the start of the 20th century and the last specimen was found on 4 August 1938. The Rhine and Main rivers were heavily polluted during the 20th century and almost all Trichoptera species became extinct there. Many caddis species have recovered since but <em>Hydropsyche tobiasi</em> was not found despite intensive searching in 1979 near Oppenheim, Wiesbaden-Schierstein, Ingelheim and in 2003-2004 near St. Goarshause und Kaub. The species was never found elsewhere and it was probably an endemic of the middle Rhine and Main rivers. It is therefore considered to be Extinct. The cause of extinction was probably the extensive river pollution in the Rhine and Main rivers in the early 20th century.","<em>Hydropsyches tobiasi </em>was found only along the middle Rhine River and Main River, both of which are large rivers.",The extinction of this species was probably caused by river pollution during the early 20th century.,No data are available as the species is extinct.,,"This species was endemic to Germany and known only from eight sites along the Rhine and Main rivers (Assmannshausen, zwischen Biebrich und Assmannshausen 1906, Siegmundung 1908, Konigswinter 1909, Rudesheim 1913, Neuenahr 1914, Bonn 1914, near Klingenberg am Main 1938). It has not been recorded since 1938.",,Terrestrial|Freshwater (=Inland waters),"No conservation actions were taken specifically for this species but the Rhine River has been intensively managed and pollution controlled. However, this followed the extinction of <em>Hydropsyche tobiasi</em>.",Palearctic,1938,false,false,Global
54357699,3172,Incilius periglenes,Extinct,,2020,2019-09-11 00:00:00 UTC,3.1,English,"Listed as Extinct because it has not been recorded since 1989, and extensive searches in the appropriate habitat, during the appropriate season within the known range, have failed to locate this species.","This species inhabited cloud and elfin forest, and was recorded breeding in temporary pools at the beginning of the rainy season.","Its restricted range, climate change, chytridiomycosis and airborne pollution probably contributed to this species' extinction (Pounds <em>et al.</em> 2006,&#160;Anchukaitis and Evans 2010,&#160;Cheng<em> et al. </em>2011).","Formerly a common species, no specimen has been seen since 1989. It last bred in normal numbers in 1987, and its breeding sites were well known. In 1988, only eight males and two females could be located. In 1989, a single male was found, and that was the last record of the species (Pounds and Crump 1994, Pounds <em>et al.</em> 1997). Extensive searches since this time have failed to produce any more records (as of September 2019).",,"This species was known only from the Reserva Biológica Monteverde in Costa Rica. It occurred at elevations of 1,500-1,620 m asl.",,Terrestrial|Freshwater (=Inland waters),"The entire range of this species was protected by the Reserva Biológica Monteverde, however, it is now thought to be Extinct. Additionally, it is&#160;listed in CITES Appendix I (as <span style=""font-style: italic;"">Bufo periglenes</span>).",Neotropical,1989,false,false,Global
