assessmentId,internalTaxonId,scientificName,redlistCategory,redlistCriteria,yearPublished,assessmentDate,criteriaVersion,language,rationale,habitat,threats,population,populationTrend,range,useTrade,systems,conservationActions,realm,yearLastSeen,possiblyExtinct,possiblyExtinctInTheWild,scopes
78447626,21530,Taudactylus diurnus,Extinct,,2022,2021-02-03 00:00:00 UTC,3.1,English,"Listed as Extinct because it has not been recorded in the wild since 1979, and extensive searches over the last 40 years have failed to locate this species. This species experienced a very rapid decline, from being relatively common to extinct in only three or four years, most likely due to chytridiomycosis.","The species&#160;was associated with permanent and temporary watercourses in montane rainforests, tall open forest, notophyll vine forest and sclerophyll fern forest (Czechura and Ingram 1990). In addition, animals were also found along watercourses in pure stands of the palm <em>Archontophoenix cunninghamia</em>, in exposed areas, in gorges, in dense non-forest riparian vegetation (<em>Lomandra longifolia</em>, <em>Carex neurochlamys</em>, <em>Elatostema reticulatum</em> and <em>Blechnum nudum</em>) and where the riparian vegetation had been slightly infested with <em>Lantana camara</em> (Czechura and Ingram 1990). Permanent streams with rocky substrates were favoured, but this species also occurred in permanent and ephemeral streams on gravel, clay, sand and soil substrates (Czechura and Ingram 1990). <br/><br/>Active frogs had been observed all year round, although less frequently during winter months (Czechura and Ingram 1990). Breeding occurred in warm weather after or during heavy rain from late October to May, with a January to March peak (Czechura and Ingram 1990, Meyer <em>et al.</em> 2001). Gravid females had been reported between November and May (Straughan and Lee 1966). Amplexus was inguinal and 24–36 eggs (2.2 mm diameter) were deposited in gelatinous clumps under rocks or branches in the water (Liem and Hosmer 1973, Watson and Martin 1973, Czechura and Ingram 1990, Meyer <em>et al. </em>2001). Tadpoles, illustrated by Liem and Hosmer (1973) and Watson and Martin (1973), were found throughout the year.","The reason(s) for the disappearance of this species remains unknown. Like <em>Rheobatrachus silus</em>, logging has occurred in catchments occupied by the species (Hines <em>et al. </em>1999); however, the effect of timber harvesting on the species has not been investigated. The species’ habitat is currently threatened by feral pigs, invasion of weed species (especially Mist Flower) and altered stream flow and water quality due to upstream disturbances (Hines <em>et al.</em> 1999). The species&#160;was not found in areas along watercourses that were heavily infested with <em>Lantana camara</em> or where the weeds <em>Baccharis halimifolia</em> and <em>Ageratina riparia</em> (Mist Flower) occurred (Czechura and Ingram 1990). The frogs were also absent from streams with very muddy water associated with the activities of feral pigs (Czechura and Ingram 1990). From what is known from similar declines and disappearance elsewhere in the world, the disease chytridiomycosis also must be suspected as a cause for the decline.","In the early 1970s this species was considered to be relatively common (McEvoy <em>et al.</em> 1979), but following a very rapid decline it has not been sighted in the wild since 1979 despite continued efforts to relocate the species (Hines <em>et al.</em> 1999). The disappearance of the species occurred over a period of three to four years, disappearing from the D’Aguilar Range in late 1975, then from the Blackall Range in late 1978, and finally from the Conondale Range in early 1979 (Czechura and Ingram 1990). There is no information on population size, structure, genetics or dynamics (Hines<em> et al.</em> 1999). This species is now believed to be extinct.",,"This Australian endemic species occurred in disjunctive subpopulations in three sub-coastal mountain ranges (Blackall, Conondale, and D’Aguilar Ranges) in southeast Queensland from Coonoon Gibber Creek in the north, to Mount Glorious in the south (Czechura and Ingram 1990, Hines <em>et al.</em> 1999). The extent of occurrence (EOO) of the species was about 1,400 km<sup>2</sup> (map in Hines <em>et al. </em>1999). The species&#160;occurred over a relatively narrow altitudinal range of 350-800 m asl with most records falling between 500–800 m asl (Czechura and Ingram 1990).",There was no use or trade of this species.,Terrestrial|Freshwater (=Inland waters),"<strong><em>Conservation Actions In-Place</em></strong><br/>The species was formerly known from Kondalilla, Conondale, Mapleton Falls, Obi Obi Gorge, Maiala, and Manorina National Parks (Tyler 1997).",Australasian,1979,false,false,Global
89815479,157719927,Chitala lopis,Extinct,,2020,2019-08-29 00:00:00 UTC,3.1,English,"This species was known only from river drainages in western and central Java. It has not been recorded from this region in over 160 years, despite extensive surveys since its first collection. Threats in the region have resulted in severe habitat degradation that has led to the extirpation of many large-bodied freshwater fish species, and include pollution from industrial, domestic, and agricultural inputs, extensive and unsustainable fishing practices, severe land conversion for urban and agricultural development (including near complete deforestation). Given a lack of reports over an extended period of time despite extensive sampling, <em>Chitala lopis</em> is assessed as Extinct.","<p>Juveniles of this species most likely inhabit forested streams and swamp forests, while adults were more likely found in lakes and large rivers, as reported for other congeners (Bleeker 1851, Kottelat and Widjanarti 2005).</p>","<p>Logging, deforestation, urban development, extensive and unsustainable fishing, pollution resulting from industrial, domestic, and agricultural point and non-point sources, and agriculture occur extensively in western and central Java (D. Lumbantobing pers. comm. 2019).</p>","<p>This species is considered extinct, as it has not been encountered since the mid 19th century (Kottelat and Widjanarti 2005, Dahruddin <em>et al.</em> 2017).</p>",,"<p>This species was known only from river drainages in Java, from the Pesanggrahan River drainage eastwards to the Kali Garang River drainage (Bleeker 1851, Kottelat and Widjanarti 2005). The historical extent of occurrence (EOO) when this species was extant is estimated at 15,920 km<sup>2</sup>, based on a minimum convex polygon calculated from its known historic distribution (Bleeker 1851).</p>",<p>This species was consumed as a food fish in subsistence fisheries.</p>,Freshwater (=Inland waters),No conservation actions are needed as the species is extinct.,Indomalayan,1851,false,false,Global
91292440,91292433,Unio madagascariensis,Extinct,,2016,2016-06-15 00:00:00 UTC,3.1,English,"This species was known from an eastern river on Madagascar close to the coast, most likely the Maningory River or the Onibe River. However, this species has not been reported for over 150 years, despite surveys in expected habitat throughout its possible historic range (both of these rivers), at appropriate times, and over a time frame appropriate to its life cycle and form. Therefore, it is here considered to be Extinct.","It was collected in an eastern river on Madagascar close to the coast, most likely the Maningory River or the Onibe River.",Pesticides and muds derived from rice field cultivation along the rivers seem to have been the major threats.,It was relatively abundant according to Sganzin (1841) but it has not been recorded since 1841.,,"This species was collected by one of Victor Sganzin's scouts prior to 1841 in the river 'Mahoupa' (east Madagascar) which according to some sources is situated near Tintingue (Anonymous 1840) and according to Sganzin (1841) near Tamatave. There are only two sizeable rivers situated between these two ports, namely the Onibe and the Maningory Rivers.",This species was not used.,Freshwater (=Inland waters),No conservation actions were in place for this species before its extinction.,Afrotropical,1841,false,false,Global
93570744,22696558,Tachybaptus rufolavatus,Extinct,,2016,2016-10-01 00:00:00 UTC,3.1,English,"Thorough surveys of Lake Alaotra in 1989, and further surveys in 2004 and 2009 failed to find any evidence of the species. Considering the last confirmed sighting of the species was in 1982, and in view of the threats to the species, its lack of mobility and restricted range, this species is now considered to be Extinct. <p></p>","<strong>Behaviour </strong>This species was presumed to be strongly sedentary since its small wings render it unable to fly long distances<strong></strong>. Some movements to highland lakes and ponds other than Lake Alaotra were thought to have occurred as a result of the degradation of its preferred habitat, as opposed to representing habitual movement<strong> </strong>(del Hoyo <em>et al</em>. 1992).<strong> </strong>It was usually found in pairs, sometimes in association with <em> T. ruficollis</em><strong> </strong>(Langrand 1990). It was thought to have a flexible breeding season, with historical records of breeding in April-June and in January-March<strong> </strong>(del Hoyo <em>et al</em>. 1992).<strong> Habitat </strong>Lake Alaotra is a large, shallow, brackish lake<strong></strong>. Its shores were historically covered with dense vegetation including papyrus and reeds, which may have been important for this species<strong> </strong>(del Hoyo <em>et al</em>. 1992).<strong> Diet </strong>It fed almost exclusively on fish<span style=""font-weight: bold;""> </span><strong></strong>(Langrand 1990)<strong><sup></sup></strong>.<strong> Breeding site </strong>Nothing was known of its breeding ecology<strong> </strong><strong></strong>(Langrand 1990). <p></p>","Several major factors contributed to this species's extinction. The use of monofilament nylon gill-nets at Lake Alaotra has proliferated recently, to the extent that they now cover a large part of the open lake. They undoubtedly kill many diving waterbirds; however the introduction of this fishing method probably only happened after the grebe had already been greatly reduced in number or had disappeared. It is also likely that the introduction of the carnivorous fish<em>&#160;</em><em>Micropterus salmoides</em>&#160;and&#160;<em>Channa striata</em>&#160;has been a major factor in the species's decline and extinction<strong> </strong>(ZICOMA 1999). Soil erosion from deforested hillsides, agriculture and sedimentation have lowered the water quality of the lake<strong></strong>. Introductions of exotic plants, mammals and fish, especially <em>Tilapia</em>, probably depleted essential foods for the species<strong> </strong>(Pidgeon 1996), and natural habitat has been lost through the conversion of marsh areas to rice farms<strong> </strong>(Wilmé 1994). Hybridisation with <em>T. ruficollis</em>, probably a recent colonist from Africa, has occurred in the past and may have been the major contributing factor in this species's decline<strong><sup> </sup></strong><strong></strong>(Hawkins <em>et al</em>. 2000)<strong></strong>. Poaching is also thought to have played a significant role in the extinction of the species (Wilmé 1994).  <p></p>",None are believed to remain in existence.,,"<em>Tachybaptus rufolavatus</em> was endemic to <strong>Madagascar</strong> and known chiefly from Lake Alaotra<strong><sup> </sup></strong>(ZICOMA 1999)<strong></strong>. There were no direct observations since 12 were seen at Lake Alaotra in December 1982, and two were seen (in addition to several apparent hybrids) near Andreba on Lake Alaotra in September 1985<strong></strong>. Individuals with some characteristics of the species were also seen on Lake Alaotra in 1986 and 1988<strong><sup> </sup></strong><strong></strong>(Hawkins <em>et al</em>. 2000)<strong></strong>.<strong> </strong>A survey in 1999 and visits in 2000 found no individuals (of this or any species of <em>Tachybaptus</em>) on Lake Alaotra or surrounding lakes<strong></strong>. Records outside the Lake Alaotra region were unreliable as species was probably incapable of prolonged flight, so in all likelihood never occurred very far from Lake Alaotra<strong><sup> </sup></strong><strong></strong>(ZICOMA 1999, Hawkins <em>et al</em>. 2000)<strong></strong><strong></strong>. A recent visit to Lake Amparihinandriamabavy failed to find any grebes<span style=""font-weight: bold;""> </span><strong style=""font-weight: normal;"">(</strong><strong></strong>F. Hawkins <em>in litt.</em> 2009). It is now considered Extinct<strong style=""font-weight: normal;"">, as no suitable wetlands remain unsurveyed in the Alaotra region (G. Young <span style=""font-style: italic;"">in litt.</span> 2009).</strong> <p></p>",,Freshwater (=Inland waters),,Afrotropical,1985,false,false,Global
93574182,22696615,Podiceps andinus,Extinct,,2016,2016-10-01 00:00:00 UTC,3.1,English,"This species was only known from Lake Tota, Colombia. It was last recorded in 1977 and is now Extinct as a result of human-induced changes to the lake, with intensive searches in 1981 failing to find it.","It inhabited freshwater wetlands, including reed-fringed pools and lakes.  <p></p>","It declined as a combined result of wetland drainage, siltation, pesticide pollution, disruption by reed harvesting, hunting and predation by introduced rainbow trout&#160;<em>Oncorhynchus mykiss</em><strong><sup>&#160;</sup></strong>(Fjeldså 1993). <p></p>",None remain.,,"<em>Podiceps andinus </em>was restricted to the Bogotá wetlands at c.2,600 m in the Eastern Andes of<strong> Colombia</strong>. It is known from 18 or 19 specimens collected between 1939-1964<strong> </strong>(Fjeldså 1993). The species was still abundant on Lake Tota in 1945<strong> </strong>(Borrero 1947), but numbers crashed in the 1950s due to various factors and the last confirmed record was in 1977<strong></strong>. Because intensive studies in 1981<strong> </strong>(Fjeldså 1993) and 1982 (Varty <em>et al</em>. 1985)<strong><sup></sup></strong> failed to find the species, it is now considered Extinct<strong> </strong>(Collar <em>et al</em>. 1994). <p></p>",,Freshwater (=Inland waters),,Neotropical,1977,false,false,Global
97386102,16527,Pelusios seychellensis,Extinct,,2003,2003-04-30 00:00:00 UTC,3.1,English,"Only three specimens are known, collected in 1895. One individual collected in 1994 was suggested to belong to this species, but this identification is ambiguous. It is possible that hybridization with <em>P. castanoides intergularis</em> may have occurred. The genetic relationships between the type specimens and living <em>P. castanoides intergularis</em> are currently under investigation. Intensive searches for <em> P. seychellensis</em> since 1996 have failed to locate any individuals.",Not known.,,Unknown.,,"<em>P. seychellensis</em> is known from only three specimens collected in 1895 from an unknown locality in the Seychelles. The precise origin of the type specimen is unknown, but it is suspected to have been Mahé.",,Terrestrial|Freshwater (=Inland waters),"All <em>Pelusios</em> terrapins are protected by Seychelles law. Research into the status of <em>P. seychellensis</em> was recommended as a high priority in the 1989 Tortoise and Freshwater Turtle Action Plan (Swingland and Klemens 1989). Despite intensive surveys since 196, no individuals have been found.",Afrotropical,1895,false,false,Global
110463483,110463465,Oncorhynchus kawamurae,Extinct in the Wild,,2019,2017-12-07 00:00:00 UTC,3.1,English,"This species was endemic to Lake Tazawa in Japan. It has been extinct from Lake Tazawa since 1940. In 1930, before this species went extinct in Lake Tazawa, eyed eggs of this species were introduced to a number of lakes, including Lake Saiko in Yamanashi prefecture, to establish subpopulations for commercial fisheries. No individuals were subsequently recorded from these lakes leading to a belief that this species had gone extinct. However, in 2010 individuals were discovered in Lake Saiko in Yamanashi prefecture and these are thought to be descendants of the eggs introduced in 1935. As these eggs were not introduced for conservation purposes (i.e. this introduction did not represent a conservation or benign introduction), the extant population in Lake Saiko is considered introduced and cannot be considered for a Red List assessment. Therefore, this species is assessed as Extinct in the Wild. There are plans to reintroduce individuals from Lake Saiko to the original native range in Lake Tazawa for conservation purposes. If this reintroduction occurs and is successful then the reintroduced population in Lake Tazawa would be eligible for assessment on the IUCN Red List.","This is a deepwater, lacustrine species (Nakabo<em>&#160;et al.</em>&#160;2011).","The extinction of this species in Lake Tazawa was the result of introduction of acidic water from the Tama River to the lake as part of a scheme to increase hydroelectric power generation in Japan (Nakabo<em>&#160;et al.</em>&#160;2011). This is not a threat to the extant, introduced subpopulation in Lake Saiko.","This species was believed to be extinct between 1940 and 2010. At present, the only known extant subpopulation of this species is in Lake Saiko in Yamanashi prefecture.&#160;Eyed eggs were introduced to this lake from the original distribution (Lake Tazawa) in 1935 to establish a subpopulation for a commercial fishery (Nakabo<em>&#160;et al.</em>&#160;2011). Hybrid individuals (with <em>Oncorhynchus nerka</em>) have been recorded from Lake Motosu&#160;(Sugiyama and Goto 2012, Muto <em>et al.</em> 2013).",,"This species was endemic to Lake Tazawa in Japan. It has been extinct from Lake Tazawa since 1940. In 1930, before this species went extinct in Lake Tazawa, eyed eggs of this species were introduced to lakes in Nagano, Yamanashi and Toyama prefectures to establish subpopulations for commercial fisheries. In 1935 eyed eggs were introduced to Lakes Saiko and Motosu in Yamanashi prefecture, and to Lake Biwa in Shiga prefecture. No individuals were subsequently recorded from these lakes leading to a belief that this species had gone extinct. However, in 2010 individuals were discovered in Lake Saiko in Yamanashi prefecture and these are thought to be descendants of the eggs introduced in 1935 (Nakabo<em> et al.</em> 2011).","Introduced individuals of this species are harvested as part of a commercial fishery for food, which is consumed only in Japan. It is also fished recreationally as a sports fish.",Freshwater (=Inland waters),"This species was assessed as Extinct in the Wild on the Japanese National Red List in 2013 after being downlisted from Extinct, which was the category assigned in 2007 (Ministry of Environment 2013).<br/><br/>There is an aquarium in Senboku that plans to reintroduce individuals from the introduced Lake Saiko subpopulation into the natural habitat in Lake Tazawa (Senboku City Municipal Office 2017).",Palearctic,1940,false,false,Global
